{
  "manifest_version": 1,
  "id": "agentic-kit.aliyun-oss",
  "version": "1.0.0",
  "display_name": "阿里云 OSS",
  "description": "读写一个阿里云 OSS 存储桶：上传文件、下载文件、列举对象，以及生成带时效的预签名链接。AccessKey 在安装时自己填，加密保存，装完之后可以更换但不会再显示出来。大文件不要走上传/下载工具——用 oss_presign_url 拿一个直传/直下链接，内容就不必经过对话上下文。",
  "author": { "name": "agentic-kit" },
  "license": "MIT",
  "requires": {
    "host_api": ">=1.0 <2.0",
    "network": ["*.aliyuncs.com"],
    "config_schema": [
      {
        "key": "endpoint",
        "label": "Endpoint",
        "description": "存储桶所在地域的接入域名，不带 https:// 和存储桶名。例如 oss-cn-hangzhou.aliyuncs.com。内网访问用 oss-cn-hangzhou-internal.aliyuncs.com。",
        "required": true,
        "placeholder": "oss-cn-hangzhou.aliyuncs.com"
      },
      {
        "key": "bucket",
        "label": "存储桶名称",
        "description": "Bucket 名，例如 my-bucket。",
        "required": true,
        "placeholder": "my-bucket"
      },
      {
        "key": "access_key_id",
        "label": "AccessKey ID",
        "description": "建议用只授权了这一个存储桶的 RAM 子账号，不要用主账号的 AccessKey。",
        "required": true,
        "placeholder": "LTAI5t..."
      },
      {
        "key": "access_key_secret",
        "label": "AccessKey Secret",
        "description": "加密保存；保存之后任何页面和接口都不会再显示出来，只能更换。",
        "required": true,
        "secret": true
      }
    ]
  },
  "extensions": {
    "tools": [
      {
        "name": "oss_put_object",
        "description": "上传一个文件到 OSS。文本内容用 content，二进制内容用 content_base64（二选一）。单次上限 5MB——更大的文件应该先用 oss_presign_url 拿一个 PUT 直传链接给用户，而不是把内容读进对话里。",
        "input_schema": {
          "type": "object",
          "required": ["key"],
          "properties": {
            "key": { "type": "string", "description": "对象名，可带目录层级，如 reports/2026-09.csv" },
            "content": { "type": "string", "description": "文本内容" },
            "content_base64": { "type": "string", "description": "二进制内容的 base64" },
            "content_type": { "type": "string", "description": "留空则按扩展名推断" }
          }
        },
        "entry": "plugin.wasm#oss_put_object"
      },
      {
        "name": "oss_get_object",
        "description": "下载一个 OSS 对象。文本会直接返回内容，二进制返回 base64。单次上限 5MB——更大的对象用 oss_presign_url 给用户一个下载链接。",
        "input_schema": {
          "type": "object",
          "required": ["key"],
          "properties": {
            "key": { "type": "string", "description": "对象名，如 reports/2026-09.csv" }
          }
        },
        "entry": "plugin.wasm#oss_get_object"
      },
      {
        "name": "oss_presign_url",
        "description": "生成一个带时效的直连链接：method=GET 用来给用户下载，method=PUT 用来让用户直传。大文件、要发给人的文件都走这个，内容不必经过对话。链接本身就是凭证，不要贴进公开渠道。",
        "input_schema": {
          "type": "object",
          "required": ["key"],
          "properties": {
            "key": { "type": "string" },
            "method": { "type": "string", "enum": ["GET", "PUT"], "description": "默认 GET" },
            "expires_seconds": { "type": "integer", "description": "有效期秒数，默认 3600，最长 7 天" }
          }
        },
        "entry": "plugin.wasm#oss_presign_url"
      },
      {
        "name": "oss_list_objects",
        "description": "列举存储桶里的对象，可按前缀过滤。用来回答\"有哪些文件\"这类问题，或在下载前确认对象名。",
        "input_schema": {
          "type": "object",
          "properties": {
            "prefix": { "type": "string", "description": "只列这个前缀下的对象，如 reports/" },
            "max_keys": { "type": "integer", "description": "最多返回多少条，默认 100，上限 1000" }
          }
        },
        "entry": "plugin.wasm#oss_list_objects"
      }
    ]
  }
}
