{
  "manifest_version": 1,
  "id": "acme.sql-connector",
  "version": "0.1.0",
  "display_name": "SQL 连接器示例",
  "description": "spec-20 §4.3 connectors 的样板插件：通过宿主注入的 connection_ref 调用 sql.query/execute/schema，插件自身永远拿不到 DSN 或密码。演示 tools[] 直接使用一个已绑定连接的最小写法。",
  "author": { "name": "agentic-kit" },
  "license": "MIT",
  "requires": {
    "host_api": ">=1.0 <2.0",
    "services": ["sql"],
    "permissions": ["read:connection", "write:connection"]
  },
  "extensions": {
    "tools": [
      {
        "name": "list_tables",
        "description": "列出已绑定连接的 public schema 下所有表名（只读，不需要 allow_write）。",
        "entry": "sql_connector.wasm#list_tables"
      },
      {
        "name": "run_query",
        "description": "在已绑定连接上执行一条只读 SQL 查询，返回行列表。",
        "input_schema": {
          "type": "object",
          "required": ["query"],
          "properties": { "query": { "type": "string" } }
        },
        "entry": "sql_connector.wasm#run_query"
      },
      {
        "name": "run_write",
        "description": "在已绑定连接上执行一条写 SQL 语句。连接若未被授予 allow_write，宿主会直接拒绝，不管这里传什么。",
        "input_schema": {
          "type": "object",
          "required": ["query"],
          "properties": { "query": { "type": "string" } }
        },
        "entry": "sql_connector.wasm#run_write"
      }
    ]
  }
}
